nb	nn
Høyesterett kom også til at ransaking i et tilfelle som dette ikke ville innebære noen krenkelse av andre staters eksklusive rett til å bruke tvang på eget territorium.	Høgsterett kom også til at ransaking i eit tilfelle som dette ikkje vil innebere ei krenking av den eksklusive retten for andre statar til å bruke tvang på eige territorium.	2
Dommen avklarer rammene for trafikkforsikringsselskapets ansvar for oppreisningserstatning etter bilansvarsloven § 4 andre punktum.	Dommen avklarer rammene for kva ansvar trafikkforsikringsselskap har for oppreisningserstatning etter bilansvarslova § 4 andre punktum.	2
Bestemmelsen er ny og gir retten hjemmel til å innhente eller gjøre bruk av biologisk materiale eller prøver som tidligere er tatt av en som kan være barnets far, dersom han er død eller utilgjengelig av andre grunner.	Er ein som kan vere far til barnet død eller utilgjengeleg av annan grunn, kan retten som prov i ei farskapssak innhente og gjere bruk av biologisk materiale eller prøver som tidlegare er tatt av han.	2
FNs sikkerhetsråds resolusjon 1373 (2001) pålegger medlemslandene å treffe nødvendige tiltak mot terrorisme gjennom lovgivning og kontrolltiltak på nasjonalt plan.	Tryggingsrådsresolusjon 1373 (2001) pålegg medlemslanda å treffe nødvendige tiltak mot terrorisme gjennom lovgjeving og kontrolltiltak på nasjonalt plan.	2
Kapittel 5 i TEK17 gir også kommunen anledning til å stille krav i reguleringsplanens bestemmelser om bruk og utforming av arealer og bygninger innenfor avgrensningen av en reguleringsplan.	Kapittel 5 i TEK17 gir også kommunen høve til å stille krav i føresegnene i reguleringsplanen om bruk og utforming av areal og bygningar innanfor avgrensinga av ein reguleringsplan.	2
Norge støtter OSSEs arbeid for å styrke opplæring av tolltjenestemenn og samarbeidet om tollspørsmål mellom Turkmenistan og Afghanistan.	Noreg støttar arbeidet til OSSE for å styrkje opplæringa av tolltenestemenn og samarbeidet om tollspørsmål mellom Turkmenistan og Afghanistan.	2
Ø;nsket om å trappe opp OSSEs innsats til støtte for tiltak for å sikre grensene mellom OSSEs deltakerland i Sentral-Asia og Afghanistan er et viktig element i vedtaket fra 2007 om OSSEs engasjement overfor Afghanistan.	Ø;nsket om å trappe opp OSSE sin innsats til støtte for tiltak for å sikre grensene mellom deltakarlanda i OSSE i Sentral-Asia og Afghanistan er eit viktig element i vedtaket frå 2007 om OSSE sitt engasjement i Afghanistan.	2
Ø;nsket om å trappe opp OSSEs innsats til støtte for tiltak for å sikre grensene mellom OSSEs deltakerland i Sentral-Asia og Afghanistan er et viktig element i vedtaket fra 2007 om OSSEs engasjement overfor Afghanistan.	Ø;nsket om å trappe opp innsatsen frå OSSE til støtte for tiltak for å sikre grensene mellom deltakarlanda i Sentral-Asia og Afghanistan er eit viktig element i vedtaket frå 2007 om OSSE-engasjementet overfor Afghanistan.	2
Planen er fortsatt under utvikling og inneholder så langt en oversikt over status i regionenes arbeid, i tillegg til ulike milepæler for tiltak som kan bidra til at minimum 5% av alle nytilsettinger fyller kravene til nedsatt funksjonsevne, og/eller hull i CV-en.	Planen er framleis under utvikling og inneheld så langt ein oversikt over status i regionene sitt arbeid, i tillegg til ulike milepælar for tiltak som kan bidra til at minimum 5% av alle nytilsettingar fyller krava til nedsett funksjonsevne, og/eller hull i CV-en.	2
I erstatningssaken mellom eieren av gjødselen og skipets eier og assurandørene, ønsker de sistnevnte å gjennomføre tester av kunstgjødselen for å avklare årsakene til skaden.	I erstatningssaka mellom eigaren av gjødsla og eigaren av skipet og assurandørane, ønsker dei sistnemnde å gjennomføre testar av kunstgjødsla for å avklare årsakene til skaden.	2
Vi må vurdere hvordan pasientens situasjon ville vært uten helsehjelpen, sammenlignet med situasjonen i dag med pasientskaden.	Vi må vurdere korleis situasjonen til pasienten ville vore utan helsehjelpa, samanlikna med situasjonen i dag med pasientskaden.	2
NPE skal arbeide systematisk for å realisere regjeringens inkluderingsdugnad, og utvikle rutiner og arbeidsformer i personalarbeidet med sikte på å nå målene for dugnaden.	NPE skal arbeide systematisk for å realisere inkluderingsdugnaden til regjeringa, og utvikle rutinar og arbeidsformer i personalarbeidet med sikte på å nå måla for dugnaden.	2
Lånekassen skal arbeide systematisk for å realisere regjeringens inkluderingsdugnad, og utvikle rutiner og arbeidsformer i personalarbeidet med sikte på å nå målene for dugnaden.	Norec skal arbeide systematisk for å realisere inkluderingsdugnaden til regjeringa, og skal utvikle rutinar og arbeidsformer i personalarbeidet med sikte på å nå måla for dugnaden.	2
Valgdirektoratet skal arbeide systematisk for å realisere regjeringens inkluderingsdugnad, og utvikle rutiner og arbeidsformer i personalarbeidet med sikte på å nå målene for dugnaden.	Norec skal arbeide systematisk for å realisere inkluderingsdugnaden til regjeringa, og skal utvikle rutinar og arbeidsformer i personalarbeidet med sikte på å nå måla for dugnaden.	2
NPE skal i årsrapporten redegjøre for hvordan etatens rekrutteringsarbeid har vært innrettet for å nå 5 %- målet og de øvrige målene for inkluderingsdugnaden.	I årsrapporten skal NPE gjere greie for korleis rekrutteringsarbeidet i etaten har vore innretta for å nå 5 %- målet og dei andre måla for inkluderingsdugnaden.	2
NPE skal arbeide systematisk for å realisere regjeringens inkluderingsdugnad, og utvikle rutiner og arbeidsformer i personalarbeidet med sikte påå nå målene for dugnaden.NPE skal i årsrapporten redegjøre for hvordan etatens rekrutteringsarbeid har vært innrettet for å nå 5 %- målet og de øvrige målene for inkluderingsdugnaden.	NPE skal arbeide systematisk for å realisere inkluderingsdugnaden til regjeringa, og utvikle rutinar og arbeidsformer i personalarbeidet med sikte påå nå måla for dugnaden.I årsrapporten skal NPE gjere greie for korleis rekrutteringsarbeidet i etaten har vore innretta for å nå 5 %- målet og dei andre måla for inkluderingsdugnaden.	2
Denne er basert på overslag for OPS-selskapets byggekostnader, overslag for kostnader til drift og vedlikehold, administrative kostnader og finansielle kostnader i prosjektfinansieringsmarkedet.	Denne er basert på overslag for OPS-selskapet sine byggekostnader, overslag for kostnader til vedlikehald og drift, administrative kostnader og finansielle kostnader i prosjektfinansieringsmarknaden.	2
(1) Avviklingsstyret skal sørge for at samvirkeforetakets forpliktelser dekkes i den utstrekning kreditor ikke har frafalt sitt krav eller samtykker i å ta en annen som debitor i stedet.	(1) Avviklingsstyret skal syte for at dei skyldnadene laget har, blir dekte i den grad kreditor ikkje har fråfalle kravet sitt eller samtykkjer i å ta ein annan som debitor i staden.	2
For slike utsalgssteder skal bare den delen av lokalet som benyttes til omsetning av varer telle med ved beregningen av utsalgsstedets salgsflate.	For slike utsalsstader skal berre den delen av lokalet som blir nytta til omsetning av varer, telje med i utrekninga av salsflata til utsalsstaden.	2
Dette utgjorde om lag halvparten av boligens omsetningsverdi.	Dette utgjorde om lag halvparten av omsetningsverdien til bustaden.	2
Lagmannsrettens konklusjon om at det ikke forelå svikt bygget på denne rettsforståelsen, og avgjørelsen ble opprettholdt.	Konklusjonen i lagmannsretten om at det ikkje låg føre svikt, bygde på denne rettsforståinga, og avgjerda blei oppretthalden.	2
Vi er av den oppfatning at dette ikke sammenfaller med forliket som ble inngått på Stortinget og at dette må endres i tråd med komiteens vedtak.	Vi meiner at dette ikkje heng saman med forliket som vart inngått på Stortinget og at dette må endrast i tråd med vedtaket til komiteen.	2
Vi ser ikke at dette sammenfaller med forliket som ble inngått på Stortinget og at dette må endres i tråd med komiteens vedtak.	Vi meiner at dette ikkje heng saman med forliket som vart inngått på Stortinget og at dette må endrast i tråd med vedtaket til komiteen.	2
Høyesterett mente dette i tilstrekkelig grad balanserte hensynene til gjenforening og barnets behov for stabilitet i hverdagen.	Høgsterett meinte dette i tilstrekkeleg grad balanserte omsyna til gjenforeining og behovet barnet hadde for stabilitet i kvardagen.	2
Dette vil også gi styrerne mindre tid til å følge opp kompetanseheving og faglig utvikling av barnehagens ansatte.	Dette vil og gje styrarane mindre tid til å følgje opp kompetanseheving og fagleg utvikling av dei tilsette i barnehagen.	2
behov for det, er en viktig del av barnehagens språkarbeid.	dei har behov for det, er ein viktig del av språkarbeidet i barnehagen.	2
en viktig del av barnehagens praksis.	ein viktig del av praksisen til barnehagen.	2
vurdering og dokumentasjon av barnehagens pedagogiske arbeid.	for vurdering og dokumentasjon av det pedagogiske arbeidet til barnehagen.	2
aktiviteter, og bli barnehagens digitale alibi.	aktivitetar, og bli det digitale alibiet til barnehagen.	2
Dette er et skoleforberedende fokus på barns språk i barnehagealder som også kan komme i konflikt med barndommens egenverdi som en viktig del av samfunnsmandatet til barnehagen.	Dette er eit skuleførebuande fokus på barn sitt språk i barnehagealder som og kan kome i konflikt med barndommen sin eigenverdi som ein viktig den av samfunnsmandatet til barnehagen.	2
og næringslivet i samsvar med regjeringens handlingsplan for oppfølging av HelseOmsorg21-strategien.	næringslivet i samsvar med regjeringa sin handlingsplan for oppfølging av HelseOmsorg21-strategien.	2
Hvordan det skal tas hensyn til universell utforming i kommunens planer, er et tema som skal drøftes i planstrategien.	Korleis det skal takast omsyn til universell utforming i planane til kommunen, er eit tema som skal drøftast i planstrategien.	2
Dette forutsetter at nettselskapets kostnader knyttet til toveiskommunikasjon er i samsvar med nettselskapet sin nytte av teknologien.	Dette føreset at nettselskapet sine kostnadar knytt til tovegskommunikasjon er i samsvar med nettselskapet sin nytte av teknologien.	2
familiens faste utgifter.	dei faste utgiftene til familien.	2
Avgjørelsen gir veiledning for hvor terskelen ligger for bruk av straffelovens bestemmelse om uaktsomt drap ved dødsulykker i trafikken.	Avgjerda gir rettleiing i kvar terskelen ligg for bruk av føresegna i straffelova om aktlaust drap ved dødsulykker i trafikken.	2
Når Norges Banks handlingsmønster i pengepolitikken blir oppfattet som stabilt og troverdig, styrker det også effekten av pengepolitikken.	Når handlingsmønsteret til Noregs Bank i pengepolitikken vert oppfatta som stabilt og truverdig, styrkjer det også verknaden av pengepolitikken.	2
Meldingen drøfter bruken av økonomiske virkemidler for å realisere regjeringens mål for mediepolitikken.	Meldinga drøftar bruken av økonomiske verkemiddel for å realisere regjeringa sine mål for mediepolitikken.	2
Samarbeidet er i dag mer uformelt, og det kan være en utfordring å opprettholde den nordiske profilen samtidig som de nordiske EU-land må avstemme sin politikk innenfor rammen av EUs felles utenriks- og sikkerhetspolitikk.	Samarbeidet er i dag meir uformelt, og det kan vere ei utfordring å oppretthalde den nordiske profilen samtidig som dei nordiske EU-landa må avstemme sin politikk innanfor ramma av den felles utanriks- og tryggingspolitikken.	2
Paragraf 3 sier at banken skal varsle departementet når det etter bankens oppfatning er behov for tiltak av penge-, kreditt- og valutapolitisk karakter fra andre enn banken.	Paragraf 3 seier at banken skal varsle departementet når det etter banken si oppfatning er behov for tiltak av penge-, kreditt- og valutapolitisk karakter frå andre enn banken.	2
Kravet i straffelovens selvvaskbestemmelse om at primærlovbruddet må skje før selvvaskhandlingen, måtte anses oppfylt uten at det var nødvendig å knytte den enkelte selvvaskhandlingen til et konkret primærlovbrudd når man, som her, stod overfor et komplekst system der selve det tilslørende systemet som var bygget opp, inngikk som en del av selvvasken.	Kravet i sjølvvaskføresegna i straffelova om at primærlovbrotet må skje før sjølvvaskhandlinga, måtte reknast som oppfylt utan at det var nødvendig å knyte den enkelte sjølvvaskhandlinga til eit konkret primærlovbrot når ein, som her, stod overfor eit komplekst system der sjølve det tilslørande systemet som var bygd opp, inngjekk som ein del av sjølvvasken.	2
Høyesterett kunne ikke se av lagmannsrettens begrunnelse at dette ivaretok kravet om andel i verdiøkningen og pekte særlig på at grunneierne måtte være med på å dekke felleskostnader til gjennomføring av ny reguleringsplan selv om de ikke deltok i den utbyggingen som ville utløse verdiøkningen.	Høgsterett kunne ikkje sjå av grunngivinga til lagmannsretten at dette varetok kravet om del i verdiauken, og peikte særleg på at grunneigarane måtte vere med på å dekke felleskostnader til gjennomføring av ny reguleringsplan sjølv om dei ikkje deltok i den utbygginga som ville utløyse verdiauken.	2
Det andre spørsmålet var om lagmannsrettens måte å behandle verdien av to bygninger på, oppfylte kravet ved urbant jordskifte om at eiendommen som deltar i fordelingen av planskapte verdier, ikke bare skal unngå tap ved jordskiftet, men også få en andel av verdiøkningen.	Det andre spørsmålet var om måten lagmannsretten hadde behandla verdien av to bygningar på, oppfylte kravet ved urbant jordskifte om at eigedommen som deltar i fordelinga av planskapte verdiar, ikkje berre skal unngå tap ved jordskiftet, men også få ein del av verdiauken.	2
Strategi i praksis NPEs strategi har som hovedmål å forenkle saksbehandlingen for å redusere tidsbruken.	Strategi i praksis Strategien til NPE har som hovudmål å forenkle saksbehandlinga for å redusere tidsbruken.	2
Periodens resultat er forskjellen mellom overføring til fondet og overføring fra fondet og resultatet viser netto endringer i fondskapitalen.	Resultatet i perioden er skilnaden mellom overføring til fondet og overføring frå fondet og resultatet viser netto endringar i fondskapitalen.	2
Artister og idrettsutøvere er omhandlet særskilt i avtalens artikkel 17.	Artistar og idrettsutøvarar er særskilt omtala i artikkel 17 i avtalen.	2
Artikkel 2 fastslår at avtalens bestemmelser skal gjelde handel med industrivarer under kapittel 25-97 i det harmoniserte system for beskrivelse og koding av varer (HS), med unntak av enkelte vareslag som går frem av avtalens vedlegg I.	Artikkel 2 slår fast at føresegnene i avtalen skal gjelde handel med industrivarer under kapittel 25-97 i det Harmoniserte system for omtale og koding av varer (HS), med unntak av visse vareslag som går fram av vedlegg I til avtalen.	2
Nei til EU har reist sak mot staten fordi det etter organisasjonens oppfatning var i strid med Grunnloven at Stortinget med alminnelig flertall samtykket til å ta EUs tredje energimarkedspakke inn i EØ;S-avtalen.	Nei til EU har reist sak mot staten fordi organisasjonen oppfatta at det var i strid med Grunnlova at Stortinget med alminneleg fleirtal samtykte i å ta EUs tredje energimarknadspakke inn i EØ;S-avtalen.	2
Bidragene til deltakelsen i EUs ulike programmer fastsettes etter fordelingsnøkkel nedfelt i EØ;S-avtalen.	Bidraga for deltaking i dei ulike EU-programma blir fastsette etter ein fordelingsnøkkel nedfelt i EØ;S-avtalen.	2
Detaljer omkring vei, fortau, gang/sykkelvei og eventuelle omkringliggende grøntområder vil avklares nærmere når reguleringsplanen utarbeides, men kan altså sikres/hjemles i arealdelens bestemmelser.	Detaljar omkring veg, fortau, gang- og sykkelveg og eventuelle omkringliggjande grøntområde vil bli nærmare avklarte når reguleringsplanen blir utarbeidd, men kan altså sikrast/heimlast i føresegnene i arealdelen.	2
Frihandelsavtalen og den bilaterale landbruksprotokollen vil bli notifisert samtidig til WTO for å tilfredsstille kravet i GATT-avtalens artikkel XXIV om at et frihandelsområde skal omfatte hoveddelen av handelen.	Frihandelsavtalen og den bilaterale landbruksprotokollen vil bli notifiserte samtidig til WTO for å tilfredsstille kravet i artikkel XXIV i GATT/WTO om at eit frihandelsområde skal omfatte hovuddelen av handelen.	2
Frihandelsavtalen og den bilaterale landbruksavtalen vil bli notifisert samtidig til WTO for å tilfredsstille GATT-avtalens artikkel XXIV om at en frihandelsavtale skal omfatte den alt overveiende delen av samhandelen.	Frihandelsavtalen og den bilaterale landbruksprotokollen vil bli notifiserte samtidig til WTO for å tilfredsstille kravet i artikkel XXIV i GATT/WTO om at eit frihandelsområde skal omfatte hovuddelen av handelen.	2
Imidlertid mente Høyesterett at det var feil av skattemyndighetene å regne med avspaseringsdager som sjøfolkenes turnusordning ga rett til som følge av de aktive arbeidsdagene offshore, ved anvendelsen av 30-dagersregelen.	Likevel meinte Høgsterett at det var feil av skattemyndigheitene å rekne med avspaseringsdagar som turnusordninga til sjøfolka gav rett til som følge av dei aktive arbeidsdagane offshore, ved bruken av 30-dagarsregelen.	2
Testen gir et godt bilde av barnets tilstand i øyeblikket, og av barnets ressurser til å takle fødselen.	Testen gir eit godt bilde av tilstanden til barnet i augeblinken, og av ressursane barnet har til å takle fødselen.	2
En måte å registrere barnets hjerteslag under fødselen.	Ein måte å registrere hjarteslaga til barnet under fødselen.	2
Betaling av bomavgift skjer enten ved bruk av elektronisk brikke (AutoPASS), eller etterskuddsvis fakturering basert på videofotografering av bilens registreringsnummer.	Betaling av bomavgift skjer anten ved bruk av elektronisk brikke (AutoPASS) eller ved etterskotsvis fakturering basert på videofotografering av registreringsnummeret på bilen.	2
Et nært samarbeid med musikk- og kulturskoler og annet kulturliv i nærmiljøet vil berike barnehagen og skolens virksomhet.	Eit nært samarbeid med musikk- og kulturskolar og anna kulturliv i nærmiljøet vil vere verdfullt for barnehagen og skolen.	2
Informasjon om miljømessige og etiske aspekter ved produkter og tjenester kan formidles for eksempel gjennom positiv miljømerking, nettbasert informasjon, produkttester, næringslivets egen markedsføring og via undervisning om forbrukstemaer i skolen.	Informasjon om miljømessige og etiske aspekt ved varer og tenester kan formidlast gjennom til dømes positiv miljømerking, nettbasert informasjon, produkttestar, marknadsføring frå næringslivet, og via undervising om forbrukstema i skolen.	2
Skolene skal ha et inntaksreglement som viser prioriteringen av søkere, dersom søkningen til skolen er større enn skolens kapasitet.	Skolane skal ha eit inntaksreglement som viser prioriteringa av søkjarar, dersom søkinga er større enn kapasiteten til skolen.	2
Den nye generelle delen skal beskrive det forpliktende grunnsynet som skal prege og støtte pedagogisk praksis i skolen og lærernes møte med elevene.	Den nye generelle delen skal beskrive det forpliktande grunnsynet som skal prege og støtte pedagogisk praksis i skulen.	2
Det som særlig manglet var en vurdering av partenes individuelle, konkrete, interesser basert på de rettslige utgangspunktene som trekkes opp i dommen.	Det som særleg mangla var ei vurdering av partane sine individuelle, konkrete, interesser basert på dei rettslege utgangspunkta som blir trekt opp i dommen.	2
Når krenkelsen lå i det samlede inntrykk begrunnelsen ga snarere enn i bruken av enkelte ord og uttrykk, fant Høyesterett at krenkelsen ikke kunne repareres bare ved at den ble påpekt i Høyesteretts dom.	Når krenkinga låg i det samla inntrykket grunngivinga gav, snarare enn i bruken av enkelte ord og uttrykk, fann Høgsterett at krenkinga ikkje kunne reparerast berre ved at ho blei påpeikt i høgsterettsdommen.	2
I sak om tilbakeføring av barn etter omsorgsovertakelse hadde lagmannsretten ikke gitt samtykke til behandling av anke over tingrettens dom.	I ei sak om tilbakeføring av barn etter omsorgsovertaking hadde lagmannsretten ikkje gitt samtykke til behandling av anke over tingrettsdommen.	2
Ved beregning av skattebelastningen må en ta utgangspunkt i hvordan en fornuftig person i erstatningssøkers livssituasjon måtte antas å ville disponere erstatningsbeløpet.	Ved utrekning av skattebelastinga må ein ta utgangspunkt i korleis ein går ut frå at ein fornuftig person i livssituasjonen til erstatningssøkjaren ville disponere erstatningssummen.	2
Dersom malmtransportørenes planer skal realiseres fullt ut vil det være behov for ytterligere kapasitetsøkning på Malmbanan/Ofotbanen.	Skal planane til malmtransportørane realiserast fullt ut, vil det vere behov for ytterlegare kapasitetsauke på Malmbanan/Ofotbanen.	2
I tillegg kan kommunen stille krav om reguleringsplan i kommuneplanens arealdel.	I tillegg kan kommunen stille krav om reguleringsplan i arealdelen i kommuneplanen.	2
Tilgjengelighet, størrelse, plassering, sikringstiltak, universell utforming, stignings- og solforhold er eksempel på kvalitets- og funksjonskrav til leke- og oppholdsarealer som ofte er nevnt i bestemmelsene til kommuneplanens arealdel.	Tilgjenge, storleik, plassering, sikringstiltak, universell utforming og stigings- og solforhold er eksempel på kvalitets- og funksjonskrav til leike- og opphaldsareal som ofte er nemnde i føresegnene til arealdelen av kommuneplanen.	2
Kommunen kan også fastsette minste uteoppholdsareal (MUA) iht. § 5-6 i teknisk forskrift av 2017 (TEK17) til felles og privat bruk i utfyllende bestemmelser til kommuneplanens arealdel.	Kommunen kan òg fastsetje minste uteopphaldsareal (MUA) i samsvar med § 5-6 i teknisk forskrift av 2017 (TEK17) til felles og privat bruk i utfyllande føresegner til arealdelen av kommuneplanen.	2
for reguleringsplaner er i hovedtrekk den samme som for kommuneplanens arealdel.	er i hovudtrekk den same som for arealdelen av kommuneplanen.	2
Dette må ligge til grunn når kommuneplanens samfunns- og arealdel kommer på den politiske dagsorden.	Dette må liggje til grunn når samfunns- og arealdelen av kommuneplanen kjem på den politiske dagsordenen.	2
10 og la til grunn at det ikke heftet feil ved fylkesmannens vedtak.	10 og la til grunn at det ikkje hefta feil ved vedtaket frå Fylkesmannen.	2
Når det gjelder organisering av statlig tilsyn med kommunesektoren, skal utvalgets arbeid skje med utgangspunkt i at tilsynet med kommunene skal tilligge fylkesmannen.	Når det gjeld organisering av statleg tilsyn med kommunesektoren, skal utvalsarbeidet skje med utgangspunkt i at tilsynet med kommunane skal høyre inn under fylkesmannen.	2
Lagmannsrettens flertall kom til at det var adgang til å presumere et samtykke i situasjoner hvor giveren er forsvunnet.	Fleirtalet i lagmannsretten kom til at det er høve til å presumere eit samtykke i situasjonar der givaren er forsvunnen.	2
Forumet skal gi impulser til Europarådets løpende arbeid for å sikre og konsolidere demokratiet i den europeiske region.	Forumet skal gje impulsar til det kontinuerlege arbeidet i Europarådet for å sikre og konsolidere demokratiet i den europeiske regionen.	2
Forumet skal gi impulser til Europarådets løpende arbeid for å sikre og befeste demokratiet i den europeiske region.	Forumet skal gje impulsar til det kontinuerlege arbeidet i Europarådet for å sikre og konsolidere demokratiet i den europeiske regionen.	2
Det er i alle land et tett samarbeid mellom sendelagene og EUs representasjon.	I alle land er det eit tett samarbeid mellom sendelaga og EU-representasjonen.	2
Kommunens inntekter fra konsesjonsavgifter og konsesjonskraft er nedfelt i de gitte konsesjoner som et grunnvilkår og med samme varighet som konsesjonen.	Inntekter til kommunane frå konsesjonsavgifter og konsesjonskraft er nedfelt i de gjevne konsesjonar som eit grunnvilkår og med same varigheit som konsesjonen.	2
Etter en kollisjon i en havn i Kina i 2007 oppstod det tvist mellom skipets eier og dem skipet var leid bort til (befrakterne) om ansvaret for kollisjonen.	Etter ein kollisjon i ei hamn i Kina i 2007 oppstod det tvist mellom eigaren av skipet og dei skipet var leigd bort til (befraktarane) om ansvaret for kollisjonen.	2
Den uformelle nordiske kontakten gir Norge informasjon om EUs drøftelser, samtidig som de øvrige nordiske land kan dra nytte av at Norge deltar i grupperinger hvor EU kun er representert ved Kommisjonen.	Den uformelle nordiske kontakten gjev Noreg informasjon om drøftingane i EU, samtidig som dei andre nordiske landa kan dra nytte av at Noreg deltek i grupperingar der EU berre er representert ved Kommisjonen.	2
Den uformelle nordiske kontakten gir Norge informasjon om EUs drøftelser, samtidig som de øvrige nordiske land kan dra nytte av at Norge deltar i grupperinger hvor EU kun er representert ved Kommisjonen.	Denne kontakten gjev Noreg informasjon om drøftingane i EU, samtidig som dei andre nordiske landa kan dra nytte av at Noreg deltek i grupperingar der EU berre er representert ved Kommisjonen.	2
Dette gjelder særlig diskusjonen om vern og bærekraftig bruk av maritimt mangfold i internasjonale havområder og sikring av tilstrekkelige ressurser til Kontinentalsokkelkommisjonens arbeid.	Dette gjeld særleg diskusjonen om vern og berekraftig bruk av maritimt mangfald i internasjonale havområde og sikring av tilstrekkelege ressursar til arbeidet i Kontinentalsokkelkommisjonen.	2
