nb	nn
- videreføre arbeidet knyttet til modernisering av journalsystemene - videreutvikle digital infrastruktur og arbeidet med IKT-sikkerhet - innføre og utvikle nødvendige nasjonale e-helseløsninger og standarder - gjennomføre tiltak for bedre kvalitet på og tilgjengelighet til helsedata - øke samordningen av helseregionenes IKT-utvikling I tråd med tidligere gitte oppdrag er de regionale helseforetakene i gang med å etablere et tettere interregionalt samarbeid på IKT-området.	- innføre og utvikle nødvendige nasjonale e-helseløysingar og standardar - gjennomføre tiltak for betre kvalitet på og tilgjengelegheit til helsedata - auke samordninga av helseregionene si IKT-utvikling I tråd med tidlegare gitte oppdrag er dei regionale helseføretaka i gang med å etablere eit tettare interregionalt samarbeid på IKT-området.	2
De regionale helseforetakenes arbeid skal være koordinert og samordnet med de nasjonale aktivitetene på e-helseområdet.	Arbeidet til dei regionale helseføretaka skal vere koordinert og samordna med dei nasjonale aktivitetane på e-helseområdet.	2
Under det finske formannskapet i EU i 1999 ble EUs nordlige dimensjon formelt etablert som et eget politikkområde og har utviklet seg til å bli et synlig uttrykk for regionalt samarbeid som bidrar til å øke velferd og utvikling både innad i EU og i det nordlige europeiske nærområdet.	Under den finske EU-formannskapen i 1999 vart den nordlege dimensjonen i EU formelt oppretta som eit eige politikkområde og har utvikla seg til å bli eit synleg uttrykk for regionalt samarbeid som er med på å auke velferda og utviklinga både i EU og i det nordlege europeiske nærområdet.	2
Bevilgningen skal også dekke kostnader knyttet til gjennomføringen av bilaterale avtaler, samarbeidet i nærområdene og kostnader til departementets øvrige internasjonale engasjement på barne- og ungdomsområdet.	Løyvinga skal òg dekkje kostnader knytte til gjennomføringa av bilaterale avtalar, samarbeidet i nærområda og kostnader til departementet sitt internasjonale engasjement på barne- og ungdomsområdet.	2
(2) Kunngjøringen skal rykkes inn to ganger med minst en ukes mellomrom i Norsk lysingsblad og i en avis som er alminnelig lest på foretakets forretningssted.	(2) Kunngjeringa skal setjast inn to gonger med minst ei vekes mellomrom i Norsk lysingsblad og i ei avis som er vanleg lesen på forretningsstaden for laget.	2
(2) Har foretaket ikke brakt forholdet i orden ved fristens utløp, skal Foretaksregisteret eller Regnskapsregisteret gjenta varselet ved kunngjøring i Norsk lysingsblad og i kortform i en avis som er alminnelig lest på samvirkeforetakets forretningssted.	(2) Har laget ikkje retta tilhøvet når fristen går ut, skal Føretaksregisteret eller Rekneskapsregisteret ta opp att varselet ved kunngjering i Norsk lysingsblad og i kortform i ei avis som er vanleg lesen på forretningsstaden for laget.	2
Også et program for destruksjon av rakettdrivstoff er en viktig del av sendelagets arbeid.	Eit program for destruksjon av rakettdrivstoff er òg ein viktig del av arbeidet til sendelaget.	2
Slik forholdene var, ville det imidlertid etter Høyesteretts syn være åpenbart urimelig om piloter og kabinansatte i dag skulle ansettes direkte i NAS og NAN på dette grunnlaget.	Slik forholda var, meinte Høgsterett at det ville vere openbert urimeleg om pilotar og kabintilsette i dag skulle tilsettast direkte i NAS og NAN på dette grunnlaget.	2
Spørsmålet i saken var om kreditorenes dividende bare skal beregnes av ansvarsdelen av fondet eller om også rentekomponenten skal inngå i dividendegrunnlaget.	Spørsmålet i saka var om dividenden til kreditorane berre skal bereknast av ansvarsdelen av fondet, eller om også rentekomponenten skal inngå i dividendegrunnlaget.	2
I forbindelse med dette arbeidet bør det vurderes om og hvordan barns oppvekstmiljø påvirkes av planforslaget.	I samband med dette arbeidet bør det vurderast om og korleis oppvekstmiljøet til barn blir påverka av planforslaget.	2
Utvalgets forslag om at eiendomsskatten skal basers på skattemessig verdi er i strid med eiendomsskatteloven hovedregel i § 8 A-2 om at eiendomsskatten skal tilsvare anleggets markedsverdi.	Forslaget frå utvalget om at eigedomsskatten skal baserast på skattemessig verdi er i strid med hovudregelen i eigedomsskattelova i § 8 A-2 om at eigedomsskatten skal tilsvara markedsverdien til anlegget.	2
I overensstemmelse med Stortingets forutsetninger er det adgang til å bringe Billighetserstatningsutvalgets avgjørelser inn for Stortinget.	I samsvar med Stortinget sine føresetnader er det høve til å bringe avgjerder i Rettferdsvederlagsutvalet inn for Stortinget.	2
3, skal trygdens fond (gjelder både grunnfond og reguleringsfond) forvaltes av styret, etter regler fastsatt av Kongen med Stortingets godkjenning.	3 skal trygda sine fond (både grunnfond og reguleringsfond) forvaltast av styret, etter reglar fastsett av Kongen med godkjenning frå Stortinget.	2
Formålet med revisjonsprosessen har fra EUs side vært å bidra til økt fleksibilitet, redusere administrative byrder samt å skape større rettslig klarhet.	Føremålet med revisjonsprosessen har frå EU si side vore å bidra til auka fleksibilitet, reduserte administrative byrder og større rettsleg klarhet.	2
For å sikre at Fellesskapets støtte anvendes effektivt, skal Kommisjonen påse at det foretas effektiv forutgående vurdering, overvåking og etterfølgende vurdering av tiltakene fastsatt ved dette vedtak.	Kommisjonen skal syte for at det vert utført effektiv førehandsvurdering, overvaking og etterfølgjande vurdering av dei tiltaka som vert gjennomførde i medhald av dette vedtaket.	2
Den aktuelle bonusordningen var en form for resultatlønnsordning og en del av innleieforetakets samlede system for vederlag for arbeid.	Den aktuelle bonusordninga var ei form for resultatlønnsordning og ein del av det samla systemet for vederlag for arbeid i innleigeføretaket.	2
De innleide mente bemanningsforetakets plikt til å sikre dem minst de samme vilkår som de fast ansatte i innleieforetaket for så vidt gjaldt lønn, ga dem krav på at bemanningsforetaket utbetalte dem samme bonus som de ville fått om de hadde vært fast ansatt i innleieforetaket.	Dei innleigde arbeidstakarane meinte at sidan bemanningsføretaket hadde plikt til å sikre dei minst dei same vilkåra som dei fast tilsette i innleigeføretaket når det gjaldt lønn, hadde dei krav på at bemanningsføretaket utbetalte dei same bonus som dei ville fått om dei hadde vore fast tilsette i innleigeføretaket.	2
Departementet legger til grunn at oppgaven som norsk kontaktpunkt skal kunne tilpasses slik at den kan utføres innenfor Nasjonalbibliotekets gjeldende budsjettrammer.	Kulturdepartementet legg til grunn at oppgåva som norsk kontaktpunkt skal kunne tilpassast slik at ho kan utførast innanfor dei gjeldande budsjettrammene til Nasjonalbiblioteket.	2
Ut fra en lang og stolt tradisjon bygger vårt rettssystem på en overbevisning om at alminnelige borgeres deltakelse i straffesaker både gjør rettsav-gjørelsene bedre, sikrer demokratisk kontroll med den dømmende makt og bidrar til at domstolene blir forankret i folket.	Ut frå ein lang og stolt tradisjon byggjer vårt rettssystem på ei overtyding om at deltaking av alminnelege borgarar i straffesakene både gjer retts-avgjerdene betre, sikrar demokratisk kontroll med den dømande makt og bidreg til at domstolane vert forankra i folket.	2
Gjennom opplæringen skal elevene få innsikt i det samiske urfolkets historie, kultur, samfunnsliv og rettigheter.	Gjennom opplæringa skal elevane få innsikt i historia, kulturen, samfunnslivet og rettane til det samiske urfolket.	2
Les mer om bivirkninger på Legemiddelverkets nettsider.	Les meir om biverknader på nettsidene til Legemiddelverket.	2
I Fellesorganet, som er opprettet i henhold til avtalen, møtes Norge, Island og EUs medlemsland for å drøfte gjennomføringen, anvendelsen og videreutviklingen av Schengen-regelverket.	I fellesorganet, som er oppretta i samsvar med avtalen, møtest Noreg, Island og medlemslanda i EU for å drøfte gjennomføringa, bruken og vidareutviklinga av Schengen-regelverket.	2
I den etterfølgende domskonferansen bestemmes sakens utfall og begrunnelsen for utfallet.	I den etterfølgjande domskonferansen avgjer ein utfallet av saka og grunngjevinga for utfallet.	2
Dette vil også være i tråd med kommuneloven § 13-1 og kommunedirektørens utredningsplikt som er å «påse at saken er forsvarlig utredet og gir et faktisk og rettslig grunnlag» før saken legges frem for det folkevalgte organet.	Dette vil òg vere i tråd med kommunelova § 13-1 og utgreiingsplikta kommunedirektøren har, som er å «påse at saken er forsvarlig utredet og gir et faktisk og rettslig grunnlag» før saka blir lagd fram for det folkevalde organet.	2
UDI bruker statens ressurser på en god måte ved å løse samfunnsoppdraget kostnadseffektivt til det beste for brukerne og samfunnet.	UDI bruker ressursane i staten på ein god måte ved å løyse samfunnsoppdraget kostnadseffektivt til det beste for brukarane og samfunnet.	2
Artikkel 6 må imidlertid ses i sammenheng med artikkel G, som åpner for at det ved lov kan foretas begrensninger i streikeretten som er nødvendige i et demokratisk samfunn til vern av andre menneskers frihet og rettigheter, eller til vern av offentlige interesser, den nasjonale sikkerhet og moral i samfunnet.	Vi må likevel sjå artikkel 6 i samanheng med del V artikkel G, som opnar for at det ved lov kan gjerast avgrensingar i streikeretten som er nødvendige i eit demokratisk samfunn for å verne fridom og rettar for andre menneske, eller til vern av offentlege interesser, den nasjonale tryggleiken og moralen i samfunnet.	2
Artikkel 6 må imidlertid ses i sammenheng med artikkel G, som åpner for at det ved lov kan settes begrensninger i retten til arbeidskamp som er nødvendige i et demokratisk samfunn til vern av andre menneskers frihet og rettigheter, eller til vern av offentlige interesser, den nasjonale sikkerhet og moral i samfunnet.	Vi må likevel sjå artikkel 6 i samanheng med del V artikkel G, som opnar for at det ved lov kan gjerast avgrensingar i streikeretten som er nødvendige i eit demokratisk samfunn for å verne fridom og rettar for andre menneske, eller til vern av offentlege interesser, den nasjonale tryggleiken og moralen i samfunnet.	2
Artikkel 6 må imidlertid ses i sammenheng med paktens del V artikkel G, som åpner for at streikeretten ved lov kan begrenses i den grad det er nødvendig i et demokratisk samfunn til vern av andre menneskers frihet og rettigheter, eller til vern av offentlige interesser, den nasjonale sikkerhet og moral i samfunnet.	Vi må likevel sjå artikkel 6 i samanheng med del V artikkel G, som opnar for at det ved lov kan gjerast avgrensingar i streikeretten som er nødvendige i eit demokratisk samfunn for å verne fridom og rettar for andre menneske, eller til vern av offentlege interesser, den nasjonale tryggleiken og moralen i samfunnet.	2
Samtidig er hensynet til barnets beste av grunnleggende betydning, og samværsordningen må ikke settes slik at den utsetter barnet for en urimelig belastning eller er skadelig for barnets helse eller utvikling.	Samtidig er omsynet til barnets beste grunnleggande, og samværsordninga må ikkje settast slik at barnet blir utsett for ei urimeleg belastning, eller slik at det er skadeleg for helsa eller utviklinga til barnet.	2
spørsmål til barnets opplevelser.	spørsmål til opplevingane til barnet.	2
Ved lagmannsrettens dom var det rettskraftig avgjort at det er grunnlag for et skjønnsmessig tillegg til selskapets inntekt etter skatteloven § 13-1 bygget på at kostnader til forskning og utvikling i Norge skulle vært fordelt innenfor konsernet.	Ved dommen i lagmannsretten var det rettskraftig avgjort at det etter skattelova § 13-1 er grunnlag for eit skjønnsmessig tillegg til inntekta til selskapet bygd på at kostnader til forsking og utvikling i Noreg skulle vore fordelte innanfor konsernet.	2
NPE skal i årsrapporten redegjøre for resultater fra oppfølging av inngåtte kontrakter og hvordan virksomhetens anskaffelser er innrettet for å gjennomføre dette hensynet.	I årsrapporten skal NPE gjere greie for resultat frå oppfølging av inngåtte kontraktar og korleis innkjøpa i verksemda er innretta for å gjennomføre dette omsynet.	2
NPE skal i årsrapporten redegjøre for resultater fra oppfølging av inngåtte kontrakter og hvordan virksomhetens anskaffelser er innrettet for å gjennomføre dette hensynet.	I årsrapporten skal NPE gjere greie for resultat frå oppfølging av inngåtte kontraktar og korleis innkjøpa til verksemda er innretta for å gjennomføre dette omsynet.	2
173 millioner kroner som en kostnad tilknyttet selskapets inntekt.	173 millionar kroner som ein kostnad knytt til inntekta til selskapet.	2
og innebærer med visse unntak at norske eiere som har kontrollerende innflytelse over et selskap hjemmehørende i et lavskatteland, blir skattlagt løpende til Norge for sin forholdsmessige andel av selskapets overskudd.	og inneber med visse unntak at norske eigarar som har kontrollerande innverknad på eit selskap som høyrer heime i eit lågskatteland, vert skattlagde løpande til Noreg for sin del av overskotet til selskapet.	2
I tillegg er det viktig for regjeringen å bygge inn mekanismer som sikrer at OPS-selskapet har de rette insentivene til å levere prosjektet i henhold til kontrakt i hele kontraktsperioden og at modellen reduserer de samlede finansieringskostnadene knyttet til OPS-selskapets lånefinansiering av utbyggingskostnadene.	I tillegg er det viktig for regjeringa å bygge inn mekanismar som sikrar at OPS-selskapet har dei rette insentiva til å levere prosjektet i samsvar med kontrakten i heile driftsperioden og at modellen reduserer dei samla lånekostnadene for OPS-selskapet.	2
Det var tilstrekkelig for domfellelse at overføringen av produksjonstegningene, dersom datterselskapet var eier, var egnet til å redusere verdien av morselskapets aksjer i datterselskapet.	Det var tilstrekkeleg for domfelling at overføringa av produksjonsteikningane, dersom dotterselskapet var eigar, var eigna til å redusere verdien av morselskapet sine aksjar i dotterselskapet.	2
slår fast at rådsdirektivet skal gjelde på islandsk og norsk på lik linje med andre språk i Fellesskapets medlemsstater.	slår fast at europaparlaments- og rådsdirektivet skal gjelde på islandsk og norsk på lik linje med dei andre språka i medlemsstatane i Fellesskapet.	2
Artikkel 3 slår fast at direktivet skal gjelde på islandsk og norsk på lik linje med andre språk i Fellesskapets medlemsstater.	Artikkel 3 slår fast at direktivet skal gjelde på islandsk og norsk på lik linje med andre språk i medlemsstatane i Fellesskapet.	2
Barn og unges medvirkning er viktig fordi dette gir barn og unge rett og mulighet til å erfare at deres stemme blir tatt på alvor, og at deres innspill får virkning på fellesskapet.	Det er viktig at barn og unge medverkar, fordi dette gir barn og unge rett og høve til å erfare at deira røyst blir teken på alvor, og at deira innspel får verknad på fellesskapet.	2
Eierselskapene til det ene skipet fremmet et direktekrav mot det andre skipets ansvarsassurandør ved søksmål i Norge.	Eigarselskapa til det eine skipet fremma ved søksmål i Noreg eit direktekrav mot ansvarsassurandøren til det andre skipet.	2
Skolen skal legge til rette for og støtte elevenes utvikling av de fem grunnleggende ferdighetene gjennom hele opplæringsløpet.	Skolen skal leggje til rette for og støtte elevane si utvikling av dei fem grunnleggjande ferdigheitene gjennom heile opplæringsløpet.	2
Høyesterett fant det ikke nødvendig å ta stilling til om NS 8406 inneholdt en uttømmende regulering av hovedentreprenørens kontraktsansvar, da hovedentreprenøren i denne saken uansett ikke kunne holdes erstatningsansvarlig overfor byggherren på grunnlag av det ulovfestede kontraktshjelperansvaret.	Høgsterett fann det ikkje nødvendig å ta stilling til om NS 8406 inneheldt ei uttømmande regulering av kontraktsansvaret til hovudentreprenøren, da hovudentreprenøren i denne saka uansett ikkje kunne haldast erstatningsansvarleg overfor byggherren på grunnlag av det ulovfesta kontraktshjelparansvaret.	2
Etter en ny vurdering og klare forpliktelser fra den tyrkiske regjeringens side om videre tiltak bl.a. for å bedre menneskerettighetssituasjonen i landet, ble det i desember 1999 gitt tillatelse til leveranser av Penguin sjømålsmissiler til det tyrkiske sjøforsvaret.	Etter ny vurdering og klare forpliktingar frå den tyrkiske regjeringa si side om vidare tiltak for å betre tilhøva for menneskerettane i landet, vart det i desember 1999 vedteke å gje løyve til utførsle av nye Penguin sjømålsmissilar til det tyrkiske sjøforsvaret.	2
(3) Omgjøringen av en beslutning om oppløsning og medlemmene av foretakets nye styre skal straks meldes til Foretaksregisteret.	(3) Omgjeringa av vedtak om oppløysing og medlemmene av det nye styret skal straks meldast til Føretaksregisteret.	2
(2) Instruksen skal blant annet inneholde regler om hvilke saker som skal styrebehandles og daglig leders arbeidsoppgaver og plikter overfor styret.	(2) Instruksen skal mellom anna innehalde reglar om kva saker som skal behandlast i styret, og om kva arbeidsoppgåver og plikter dagleg leiar har i høve til styret.	2
demokratiproblem når en betydelig del av kommunens oppgaveløsning skjer i regi av organer som ikke er direkte underlagt kommunestyret.	demokratiproblem når ein monaleg del av oppgåveløysinga til kommunen skjer i regi av organ som ikkje er direkte underlagt kommunestyret.	2
Viktige områder er styrking av rettsvesenets uavhengighet, kampen mot korrupsjon og hvitvasking av penger, økt pressefrihet og større grad av pluralisme i medier, samt styrking av det lokale selvstyret.	Viktige område er styrking av sjølvstendet til rettsvesenet, kampen mot korrupsjon og kvitvasking av pengar, større pressefridom og større grad av pluralisme i media, i tillegg til styrking av det lokale sjølvstyret.	2
De regionale helseforetakene etablerer en nasjonal koordineringsfunksjon, i tråd med erfaringene fra Nederland og anbefalingen i Helsedirektoratets evalueringsrapport.	Dei regionale helseføretaka etablerer ein nasjonal koordineringsfunksjon, i tråd med erfaringane frå Nederland og tilrådinga i evalueringsrapporten frå Helsedirektoratet.	2
Tidspunktet for utskrivning fra sykehus etter fødsel skal tilpasses kvinnens og det nyfødte barnets behov, og skal besluttes i samråd med kvinnen, i tråd med Helsedirektoratets veileder.	Tidspunktet for utskriving frå sjukehus etter fødsel skal vurderast etter det kvinna og det nyfødde barnet treng, og skal avgjerast i samråd med kvinna, i tråd med rettleiar frå Helsedirektoratet.	2
Foretaksmøtet viste til de regionale helseforetakenes rolle i oppbyggingen av beredskapslager for legemidler på nivå 1 for spesialisthelsetjenesten, delegert fra Helsedirektoratet.	Føretaksmøtet viste til dei regionale helseføretaka si rolle i oppbygginga av beredskapslager for legemiddel på nivå 1 for spesialisthelsetenesta, delegert frå Helsedirektoratet.	2
OSSEs arbeid for beskyttelse av menneskerettighetene, utvikling av demokrati og styrking av rettsstatsprinsippene er viktige bidrag til langsiktig stabilitet.	Arbeidet OSSE gjer for vern av menneskerettane, utvikling av demokrati og styrking av rettsstatsprinsippa, er viktige bidrag til langsiktig stabilitet.	2
OSSEs arbeid for beskyttelse av menneskerettighetene, utvikling av demokrati og styrking av rettsstatsprinsippene er viktige bidrag til langsiktig stabilitet.	OSSE sitt arbeid for vern av menneskerettane, utvikling av demokrati og styrking av rettsstatsprinsippa er viktige tilskot til langsiktig stabilitet.	2
Oppfølging av statsminister Erna Solbergs rolle som leder av generalsekretærens pådrivergruppe for Tusenårsmålene sammen med Rwandas president, Paul Kagame, vil ha høy prioritet.	Oppfølginga av statsminister Erna Solberg si rolle som leiar av Generalsekretærens pådrivargruppe for tusenårsmåla, samane med Rwandas president Paul Kagame, vil ha høg prioritet.	2
Eventuelle kostnadsøkninger over forventet kostnad (P50) ut over prisstigning skal dekkes med statlige midler innenfor rammen til Nye Veier AS og bompenger etter samme prosentvise fordeling som innenfor prosjektets forventede kostnad.	Eventuelle kostnadsaukar over forventa kostnad (P50) ut over prisstiging skal dekkast med statlege midlar innanfor ramma til Nye Veier AS og bompengar etter same prosentvise fordeling som innanfor den avtalte kostnaden for prosjektet.	2
Eventuelle kostnadsøkninger over forventet kostnad (P50) ut over prisstigning skal dekkes med statlige midler innenfor rammen til Nye Veier AS og bompenger etter samme prosentvise fordeling som innenfor prosjektets avtalte kostnad.	Eventuelle kostnadsaukar over forventa kostnad (P50) ut over prisstiging skal dekkast med statlege midlar innanfor ramma til Nye Veier AS og bompengar etter same prosentvise fordeling som innanfor den avtalte kostnaden for prosjektet.	2
Kommunens logo Lokale energiselskaper har sørget for og lagt til rette for god bredbåndsdekning i	• Lokale energiselskap har sørga for og lagt til rette for god breibandsdekning i distriktet.	2
På grunn av barnas sårbarhet, reaksjoner etter samvær og utfordringer med kvaliteten i samværene, var det likevel nødvendig å begrense samværsomfanget til fem årlige samvær på det nåværende tidspunktet.	På grunn av at barna var sårbare, reaksjonar etter samvær og utfordringar med kvaliteten i samværa var det likevel nødvendig å avgrense samværsomfanget til fem årlege samvær på det noverande tidspunktet.	2
Å; skape usikkerhet omkring fellesrådene formelle status og mandat, vil etter rådmannens vurdering kunne bidra til å svekke legitimiteten til den lokale kirkes ansvar på dette feltet.	Å; skape usikkerhet omkring fellesråda sin formelle status og mandat, vil etter rådmannen si vurdering kunne bidra til å svekke legitimiteten til den lokale kyrkja sitt ansvar på dette feltet.	2
helseforetakene og universitetene og høyskolene om å gjennomgå fagplaner for utdanningene med sikte på å sikre tilrettelegging av praksis innenfor habilitering og rehabilitering, samt understreke tjenestens ansvar som praksisarena for å sikre gode læringsmuligheter innen fagfeltet.	og universiteta og høgskulane om å gå gjennom fagplanar for utdanningane for å sikre tilrettelegging av praksis innanfor habilitering og rehabilitering, og understreke det ansvaret tenesta har som praksisarena for å sikre gode læringsvilkår innanfor fagfeltet.	2
Samhandlingsreformens mål om mer helhetlige og sammenhengende tjenester uten unødige brudd og forsinkelser gjelder i stor grad for habiliterings- og rehabiliteringsfeltet.	Måla i samhandlingsreforma om meir heilskaplege og samanhengande tenester utan unødige brot og forseinkingar gjeld i stor grad for habiliterings- og rehabiliteringsfeltet.	2
To av styrets medlemmer velges etter forslag fra henholdsvis Utdannings- og forskningsdepartementet og Miljøverndepartementet.	To av medlemmene i styret blir valde etter forslag frå respektive Utdannings- og forskingsdepartementet og Miljøverndepartementet.	2
For en omtale av regjeringens samlede klima- og miljørelevante saker, se Klima- og miljødepartementets fagproposisjon.	For ein omtale av regjeringas samla klima- og miljørelevante saker, sjå fagproposisjonen frå Klima- og miljødepartementet.	2
Det ble tatt en vevsprøve fra mannens prostata, og denne viste at han hadde prostatakreft uten spredning til omkringliggende vev eller skjelettet.	Det blei teke ein vevsprøve frå prostataen til mannen, og prøven viste at han hadde prostatakreft utan spreiing til omkringliggjande vev eller skjelettet.	2
Barn og unges representant kan også være med på oppstartsmøtet.	Representanten for barn og unge kan òg vere med på oppstartsmøtet.	2
Protokollføreren fører rettsboken over rettens forhandlinger og kan ellers utføre forefallende praktiske oppgaver under rettsmøtet.	Protokollføraren fører rettsboka over forhandlingane i retten og kan elles utføre førefallande praktiske oppgåver under rettsmøtet.	2
Uten denne regelen ville den som har krevd innsyn ikke kunne iverksette tvangsfullbyrdelse av kravet om innsyn på grunnlag av klageinstansens vedtak, men måtte først ha gått til domstolene for å få dom for kravet.	Utan denne regelen ville den som kravd innsyn, ikkje kunne setje i verk tvangsfullføring av innsynskravet på grunnlag av vedtaket frå klageinstansen, men måtte først ha gått til domstolane for å få dom for kravet.	2
Høyesteretts flertall på tre dommere kom til at foreldelsesfristen kunne begynne å løpe selv om det ikke var truffet endringsvedtak i en situasjon der det avgiftspliktige selskapet var konkurs eller det av andre grunner var på det rene at selskapet selv var ute av stand til å betale avgiftskravet.	Fleirtalet på tre dommarar kom til at foreldingsfristen kunne begynne å løpe sjølv om det ikkje var gjort eit endringsvedtak i ein situasjon der det avgiftspliktige selskapet var konkurs eller det av andre grunnar var på det reine at selskapet sjølv var ute av stand til å betale avgiftskravet.	2
Høyesterett opphevet lagmannsrettens dom fordi domsgrunnene etterlot tvil om forståelsen av forsettskravet.	Høgsterett oppheva lagmannsrettsdommen fordi domsgrunnane etterlét tvil om forståinga av forsettskravet.	2
departementets vedtak ved kopi av dette brevet.	departementet sitt vedtak ved kopi av dette brevet.	2
