nb	nn
FNs generalforsamling vedtok i desember 1991 en resolusjon som oppfordret medlemslandene til fra og med 1992 å rapportere årlig om sin eksport og import av tyngre konvensjonelle våpen til et eget FN-register over våpenoverføringer.	Generalforsamlinga i FN vedtok i desember 1991 ein resolusjon som oppfordra medlemslanda til frå og med 1992 å rapportere årleg om eigen eksport og import av tyngre konvensjonelle våpen til eit eige FN-register over våpenoverføringar.	2
De Forente Nasjoners generalforsamling vedtok i desember 1991 en resolusjon som oppfordret medlemslandene om fra og med 1992 å rapportere årlig om sin eksport og import av tyngre konvensjonelle våpen til et eget FN-register over våpenoverføringer.	Generalforsamlinga i FN vedtok i desember 1991 ein resolusjon som oppfordra medlemslanda til frå og med 1992 å rapportere årleg om eigen eksport og import av tyngre konvensjonelle våpen til eit eige FN-register over våpenoverføringar.	2
FNs generalforsamling vedtok i desember 1991 en resolusjon som fra og med 1992 oppfordret medlemslandene til å rapportere årlig om sin eksport og import av tyngre konvensjonelle våpen til et eget FN-register over våpenoverføringer.	Generalforsamlinga i FN vedtok i desember 1991 ein resolusjon som oppfordra medlemslanda til frå og med 1992 å rapportere årleg om eigen eksport og import av tyngre konvensjonelle våpen til eit eige FN-register over våpenoverføringar.	2
Agendaen søker gjennom de 17 målene bidra til bedre liv for alle mennesker, fjerne fattigdom, øke alle menneskers mulighet til utdanning, trygge liv, likestilling mellom kjønnene, gi ekstra støtte til utsatte, kvinner, barn, og unge jenter og mennesker med funksjonsnedsettelser.	Agendaen søker gjennom dei 17 måla å bidra til eit betre liv for alle menneske, fjerne fattigdom, auke alle menneske sin moglegheit til utdanning, trygge liv, likestilling mellom kjønna, gi ekstra støtte til utsette, kvinner, barn, og unge jenter og menneske med funksjonsnedsettingar.	2
Agendaen søker gjennom de 17 målene å bidra til et bedre liv for alle mennesker, fjerne fattigdom, øke alle menneskers mulighet til utdanning, trygge liv, likestilling mellom kjønnene, gi ekstra støtte til utsatte, kvinner, barn, og unge jenter og mennesker med funksjonsnedsettelser.	Agendaen søker gjennom dei 17 måla å bidra til eit betre liv for alle menneske, fjerne fattigdom, auke alle menneske sin moglegheit til utdanning, trygge liv, likestilling mellom kjønna, gi ekstra støtte til utsette, kvinner, barn, og unge jenter og menneske med funksjonsnedsettingar.	2
Som en generell huskeregel skal du gi tegn i god tid før du svinger eller endrer kjøretøyets plassering i kjørefeltet, men ikke slik at det kan oppstå misforståelser.	Som ein generell hugseregel skal du gi teikn i god tid før du svingar eller endrar køyretøyet si plassering i køyrefeltet, men ikkje slik at det kan oppstå misforståingar.	2
Denne avtalen skal dekke norsk idretts samlede tilskuddsplikt, og vil med visse unntak erstatte den lovpålagte tilskuddsplikten som påhviler NIF.	Denne avtalen skal dekkje den samla tilskotsplikta for norsk idrett, og vil med visse unntak erstatte den lovpålagde tilskotsplikta som NIF har.	2
Selv om pasienten som følge av sin grunnsykdom ofte vil være alvorlig syk og med nedsatt forsørgerevne, vil pasienten fortsatt bidra med sine eventuelle inntekter eller pensjoner til dekning av familiens utgifter.	Sjølv om pasienten som følgje av grunnsjukdomen sin ofte vil vere alvorleg sjuk og med nedsett forsørgjarevne, vil pasienten framleis bidra med dei eventuelle inntektene eller pensjonane sine til dekning av utgifter familien har.	2
Europarådets handlingsplan for Ukraina er organisasjonens mest omfattende handlingsplan.	Europarådets handlingsplan for Ukraina er den mest omfattande organisasjonen har.	2
I 26 prosent av avslagssakene er det konkludert med at det ikke er noen sannsynlig sammenheng mellom helsehjelpen gitt av fastlegen og pasientens plager.	I 26 prosent av avslagssakene er det konkludert med at det ikkje er nokon sannsynleg samanheng mellom helsehjelpa gitt av fastlegen og dei plagene pasienten har.	2
(pdf) til KS (kommunesektorens organisasjon) med informasjon om hvilke rettigheter de eldre på kommunale helse- og omsorgsinstitusjoner har.	(pdf) til KS (organisasjonen til kommunesektoren) med informasjon om kva rettar dei eldre på kommunale helse- og omsorgsinstitusjonar har.	2
For å stimulere til næringsutvikling skal næringslivet involveres i planlegging og utforming av planer og veivalg for å sikre best mulig utnyttelse av næringslivets kompetanse og ressurser.	For å stimulere til næringsutvikling skal næringslivet involverast i planlegging og utforming av planar og vegval for å sikre best mogeleg utnytting av kompetansen og ressursane næringslivet har.	2
Norge skal fremme Sikkerhetsrådets beskyttelsesmandater blant annet gjennom å støtte resolusjoner og delta i debatter om kvinner, fred og sikkerhet, seksualisert vold, barn i væpnet konflikt, beskyttelse av sivile i væpnet konflikt og ansvaret for å beskytte («Responsibility to Protect», R2P), samt støtte konkret innsats for å styrke FN-operasjonenes kapasitet til å gjennomføre bredt anlagte beskyttelsesstrategier.	Noreg skal fremje vernemandata til Tryggingsrådet, mellom anna gjennom å støtte resolusjonar og ta del i debattar om kvinner, fred og tryggleik, seksualisert vold, barn i væpna konflikt, vern av sivile i væpna konflikt og ansvaret for å verne («Responsibility to Protect», R2P), i tillegg til å støtte konkret innsats for å styrkje den kapasiteten som FN-operasjonane har til å gjennomføre omfattande vernestrategiar.	2
Særreglene for videre opptjening av pensjon i bestemmelsens tredje ledd gjelder ikke plikten til å dekke slike premier.	Særreglane for vidare opptening av pensjon i tredje ledd i føresegna gjeld ikkje plikta til å dekke slike premiar.	2
Ved å føre tilsyn og behandle klager skal fylkesmannen medvirke til å sikre at det i kommunale vedtak blir tatt hensyn til den enkelte innbyggers rettssikkerhet.	Ved å føre tilsyn og behandle klager skal fylkesmannen medverke til å sikre at det i kommunale vedtak blir teke omsyn til rettstryggleiken til den enkelte innbyggjar.	2
MÅ;LET MED UTDANNING Utdanningen skal fremme utvikling av barnets personlighet, og teoretiske og praktiske ferdigheter.	MÅ;LET MED UTDANNING Utdanninga skal fremje utvikling av personlegdommen til barnet, og teoretiske og praktiske dugleikar.	2
Lovgivers begrunnelse for utleveringsforbudet er å sikre at befolkningen har tillit til medisinsk- og helsefaglig forskning og forskningsbiobanker.	Lovgivaren grunngir utleveringsforbodet med at ein vil sikre at befolkninga har tillit til medisinsk- og helsefagleg forsking og forskingsbiobankar.	2
Foretaksmøtet ber de regionale helseforetakene i fellesskap gå gjennom helseforetakenes bruk av sluttavtaler, etterlønn og avtaler om retrettstillinger til ledende ansatte, og på grunnlag av denne gjennomgangen vurdere om man bør etablere et felles normativt rammeverk for bruk og innretning av slike avtaler.	Føretaksmøtet ber dei regionale helseføretaka i fellesskap gå gjennom bruk av sluttavtalar, etterløn og avtalar om retrettstillingar til leiande tilsette i helseføretaka, og på grunnlag av denne gjennomgangen vurdere om ein bør etablere eit felles normativt rammeverk for bruk og innretting av slike avtalar.	2
Basert på en konkret vurdering av forholdene i saken kom Høyesterett til at ektefellens aksjer i den nye selskapsstrukturen ikke klart kunne føres tilbake til aksjene i det selskapet ektefellen solgte seg ut av, eller til andre skjevdelingsmidler.	Basert på ei konkret vurdering av forholda i saka kom Høgsterett til at aksjane til ektefellen i den nye selskapsstrukturen ikkje klart kunne førast tilbake til aksjane i det selskapet ektefellen selde seg ut av, eller til andre skeivdelingsmidlar.	2
Spørsmålet i saken var om bestemmelsen i reindriftsloven § 67 om objektivt solidaransvar for reineiere er i strid med samenes vern som urfolk etter Grunnloven og folkerettslige regler.	Spørsmålet i saka var om føresegna i reindriftslova § 67 om objektivt solidaransvar for reineigarar er i strid med vernet av samane som urfolk etter Grunnlova og folkerettslege reglar.	2
Forbrukernes krav mot entreprenøren rammes ikke av reglene om sluttoppgjør i § 48, og de hadde også fremsatt kravet tidsnok til ikke å bli rammet av ulovfestede passivitetsregler.	Krav frå forbrukarane til entreprenøren blir ikkje ramma av reglane om sluttoppgjer i § 48, og forbrukarane hadde også sett fram kravet tidsnok til ikkje å bli ramma av ulovfesta passivitetsreglar.	2
Etter departementets vurdering vil et marked som ikke bare omfatter Norge, bidra til å redusere sårbarheten til konsernet og gi NSB flere ben å stå på, noe som vurderes som særskilt viktig for godsvirksomheten og bussvirksomheten.	Det er viktig at støttefunksjonane framleis blir effektiviserte gjennom for eksempel konkurranseutsetjing og outsourcing, og at eigedomsverksemda blir utvikla med sikte på sal av driftsuavhengige eigedomar.	2
De overordnede føringene i kommuneplanens arealdel skal følges opp i mer detaljerte reguleringsplaner.	Dei overordna føringane i arealdelen av kommuneplanen skal følgjast i meir detaljerte reguleringsplanar.	2
Dette må avklares i kommuneplanens arealdel og senere følges opp i reguleringsplaner.	Dette må avklarast i arealdelen av kommuneplanen og seinare følgjast opp i reguleringsplanar.	2
Norge skal opptre konstruktivt og kritisk overfor FNs ressursbruk med sikte på en mer resultatbasert ledelse, økt evne til å dokumentere oppnådde resultater samt gode rapporteringsrutiner.	Noreg skal opptre konstruktivt og kritisk overfor ressursbruken i FN med sikte på meir resultatbasert leiing, auka evne til å dokumentere oppnådde resultat og gode rapporteringsrutinar.	2
DBE har i samarbeid med Direktoratet for sivilt beredskap, Universitetet i Oslo og forsikringsselskapet Skogbrann gjennomført et forskningsprosjekt med gjennomgang av nasjonal- og internasjonal litteratur om skogbranners miljøpåvirkning.	DBE har i samarbeid med Direktoratet for sivil beredskap, Universitetet i Oslo og forsikringsselskapet Skogbrann gjennomført eit forskingsprosjekt med gjennomgang av nasjonal og internasjonal litteratur om miljøpåverknad frå skogbrannar.	2
Kvinnens gynekolog hadde funnet en polypp i livmoren hennes.	Gynekologen til kvinna hadde funne ein polypp i livmora hennar.	2
Saken om fastlegers mulighet til å reservere seg mot henvisning og behandling ved alvorlige samvittighetskonflikter knyttet til liv og død, er derfor ikke et spørsmål om abortloven eller en debatt om aktiv dødshjelp, men et spørsmål om å gi den enkelte fastlege mulighet til ikke foreta slike henvisninger av samvittighetsgrunner.	Saken om fastleger sitt høve til å reservere seg mot henvising og behandling ved alvorlige samvitskonfliktar knytt til liv og død, er derfor ikkje eit spørsmål om abortloven eller en debatt om aktiv dødshjelp, men et spørsmål om å gi den enkelte fastlege moglegheit til ikkje foreta slike henvisingar av samvitsgrunnar.	2
Nye Veiers oppgave er å bidra til helhetlig og sammenhengende utbygging av trafikksikre riksveier, større kostnadseffektivitet, økt samfunnsøkonomisk lønnsomhet og styrking og utvidelse av bo- og arbeidsmarkedsregioner.	Oppgåva til Nye Veier er å bidra til heilskapleg og samanhengande utbygging av trafikksikre riksvegar, større kostnadseffektivitet, auka samfunnsøkonomisk lønnsemd og styrking og utviding av bu- og arbeidsmarknadsregionar.	2
I disse sakene har pasientene fått en skade eller plager som følge av behandlingen, men det har ikke vært svikt i behandlingen fra fastlegens side, og plagene som har oppstått er kjente komplikasjoner.	I desse sakene har pasientane fått ein skade eller plager som følgje av behandlinga, men det har ikke vore svikt i behandlinga frå fastlegen si side, og plagene som har oppstått er kjende komplikasjonar.	2
SHIRBRIG ble etablert i 1996 for å styrke FNs evne til rask utplassering av hovedkvarter og styrker, og kan også støtte FN i planleggingsfasen av nye operasjoner.	SHIRBRIG vart etablert i 1996 for å styrkje FN i evna til rask utplassering av hovudkvarter og styrkar, og kan òg støtte FN i planleggingsfasen for nye operasjonar.	2
Det vil arbeides for at FNs kontor for koordinering av humanitær assistanse (OCHA) og FNs humanitære system får en bredere krets av støttespillere og samarbeidspartnere, både blant FNs medlemsland, privat sektor og nasjonale og regionale organisasjoner.	Vi vil arbeide for at FN-kontoret for koordinering av humanitær assistanse (OCHA) og det humanitære FN-systemet får ein breiare krins av støttespelarar og samarbeidspartnarar, både blant medlemslanda i FN, i den private sektoren og i nasjonale og regionale organisasjonar.	2
Nordisk Ministerråds Europa-aktivitet innebærer også samarbeid med EU-institusjonene i Brussel, EU-representasjonene/delegasjonene, Europarådet, EFTA-sekretariatet og en rekke frivillige interesseorganisasjoner.	Europaaktiviteten til Nordisk Ministerråd inneber òg samarbeid med EU-institusjonane i Brussel, EU-representasjonane/ delegasjonane, Europarådet, EFTA-sekretariatet og ei rekkje frivillige interesseorganisasjonar.	2
Utvalgets forslag om å avvikle ordningene vil være et brudd på de forutsetningene som lå til grunn for de gitte konsesjoner.	Forslaget frå utvalget om å avvikle ordningane vil vera eit brot på dei føresetnadane som låg til grunn for dei gjevne konsesjonar.	2
Kunnskap om samfunnets språklige mangfold gir alle elever verdifull innsikt i ulike uttrykksformer, ideer og tradisjoner.	Kunnskap om det språklege mangfaldet i samfunnet gir alle elevar verdifull innsikt i ulike uttrykksformer, idear og tradisjonar.	2
Norge har deltatt i en rekke internasjonale prosesser for effektivisering av FNs sanksjons­politikk og styrking av gjennomføringen av sanksjoner.	Noreg har delteke i ei rekkje internasjonale prosessar for effektivisering av sanksjonspolitikken i FN og styrking av gjennomføringa av sanksjonar.	2
november 1984 om utbetalinger av gitte bevilgninger gjennom at tilskudd til Verdensbankens Forest Carbon Partnership Facility Carbon Fund kan utbetales med det formål å betale for fremtidige verifiserte utslippsreduksjoner. XXII	november 1984 om utbetalingar av gjevne løyvingar gjennom at tilskot til Emergent Forest Financing Accelerator kan utbetalast med det formål å betale for framtidige verifiserte utsleppsreduksjonar.	2
I tillegg til selve loven, er det foreslått å etablere en egen forskrift som vil ha som formål å konkretisere viktige deler av lovens intensjoner.	I tillegg til sjølve lova, er det foreslått å etablere eigen forskrift som vil ha som formål å konkretisere viktie delar av lovverket sine intensjonar.	2
Fylkesmannens vedtak vil gjelde et nærmere angitt område, og vil normalt ikke være knyttet til bestemte personer.	Vedtaket til fylkesmannen vil gjelde eit nærmare bestemt område, og vil normalt ikkje vere knytt til bestemte personar.	2
Det tyder på at regjeringens forslag om privatisering er basert på et prinsipielt ønske, og ikke et krav fra forbrukere eller kommuner.	Det tyder på at regjeringa sitt forslag om privatisering er basert på eit prinsipielt ynskje, og ikkje eit krav frå kunden eller kommunar.	2
Utvalgets arbeid skal omfatte tilsyns- og kontrollordninger som er spesifikt rettet mot kommuner eller fylkeskommuner.	Utvalsarbeidet skal omfatte tilsyns- og kontrollordningar som er spesifikt retta mot kommunar eller fylkeskommunar.	2
Fylkesmannens arbeid knyttet til kartlegging av naturmangfold og kvalitetssikring av data gir viktig informasjon til nasjonale databaser og grunnlag for en mer effektiv og målrettet forvaltning av arter og naturtyper.	Fylkesmannen sitt arbeid knytt til kartlegging av naturmangfald og kvalitetssikring av data gir viktig informasjon til nasjonale databasar og grunnlag for meir effektiv og målretta forvalting av artar og naturtypar.	2
analyse av dagens kontorløsning og kartlegging av behov i framtidig løsning, eiendomssøk, befaringer, utarbeide kravspesifikasjon og tilbudsdokumentasjon og sende ut tilbudsinvitasjon til aktuelle utleiere.	analyse av kontorløysinga vi har i dag og kartlegging av behov i framtidig løysing, eigedomssøk, synfaringar, utarbeide kravspesifikasjon og tilbodsdokumentasjon og sende ut tilbodsinvitasjon til aktuelle utleigarar.	2
Ved avgjørelsen la Høyesterett blant annet vekt på at kravene til aktors habilitet langt på vei, men ikke fullt ut, er sammenfallende med de krav som stilles til dommere.	Ved avgjerda la Høgsterett mellom anna vekt på at krava til habilitet for aktor langt på veg, men ikkje fullt ut, fell saman med dei krava som blir stilte til dommarar.	2
Aktuelle saker Tradisjonelt sett er det mindre straffesaker med inntil en dags varighet som er aktuelle for slike besøk, og i utgangspunktet er det disse vi tilbyr for skoleklasser og andre tilhørere.	Tradisjonelt er det mindre straffesaker som varer inntil éin dag, som er aktuelle for slike besøk, og i utgangspunktet er det desse me tilbyr for skuleklassar og andre tilhøyrarar.	2
De må også utvikle læringsstrategier som stimulerer til pedagogisk bruk av entreprenørskap hos framtidens lærere.	Dei må òg utvikle læringsstrategiar som stimulerer til pedagogisk bruk av entreprenørskap hos dei som skal bli lærarar.	2
Høyesterett la til grunn at bedømmelsen av rettens eventuelle plikt til å gi veiledning om de rettslige spørsmålene i saken – drive materiell prosessledelse – måtte skje med utgangspunkt i tvisteloven § 11-5 også når sivile krav behandles i en straffesak der de siktede er representert av forsvarer.	Høgsterett la til grunn at vurderinga av den eventuelle plikta retten har til å gi rettleiing om dei rettslege spørsmåla i saka – drive materiell prosessleiing – må skje med utgangspunkt i tvistelova § 11-5 også når sivile krav blir behandla i ei straffesak der dei sikta er representerte av forsvarar.	2
Hensikten med avtalen er å skape større transparens gjennom gjensidig åpning av landenes luftrom for et avtalt antall årlige overflyvninger med fly utstyrt med bestemte sensorer.	Føremålet med avtalen er å skape større transparens gjennom gjensidig opning av luftrommet til landa for eit avtalt tal på årlege overflygingar med fly utstyrt med bestemde sensorar.	2
Hensikten med avtalen er å skape større transparens gjennom gjensidig åpning av landenes luftrom for et avtalt antall årlige overflyvninger med fly utstyrt med bestemte sensorer.	Føremålet med avtala er å skape større openskap gjennom gjensidig opning av landa sine luftrom for eit avtalt tal årlege overflygingar med fly som er utstyrde med bestemte sensorar.	2
FNs relevans må sees i lys av fremveksten av regionale organisasjoner og samarbeidsstrukturer.	Relevansen til FN må sjåast i lys av framvoksteren av regionale organisasjonar og samarbeidsstrukturar.	2
Høyesterett kom til at uttrekk og tilgjengeliggjøring på Internett av det aktuelle materialet var i strid med Lovdatas enerett etter åndsverkloven § 24 for så vidt gjaldt avgjørelser fra en DVD utgitt av Lovdata i 2005 og Lovdatas onlinedatabaser.	Høgsterett kom til at uttrekk og tilgjengeleggjering på internett av det aktuelle materialet var i strid med Lovdata sin einerett etter åndsverklova § 24 for så vidt gjaldt avgjerder frå ein DVD utgitt av Lovdata i 2005 og Lovdata sine onlinedatabasar.	2
Ved denne typen infeksjon er det i retningslinjene anbefalt syv dagers behandling, men i svært alvorlige tilfeller kan det gis inntil 14 dager med antibiotika i høye doser.	Ved denne typen infeksjon er det i retningslinjene tilrådd behandling i sju dagar, men i svært alvorlege tilfelle kan ein gi inntil 14 dagar med antibiotika i høge dosar.	2
Slik kan de følges opp i handlingsdelen og økonomiplanen og bli en del av kommunenes prioritering av ressurser.	Slik kan dei følgjast opp i handlingsdelen og økonomiplanen og bli ein del i prioriteringa kommunane gjer av ressursar.	2
Det bidrar til bedre dialog mellom statsetatene og større oppmerksomhet på statsetatenes ansvar for tidlig og aktiv deltagelse i kommunale planprosesser.	Det bidreg til betre dialog mellom statsetatane og større merksemd på ansvaret statsetatane har for tidleg og aktiv deltaking i kommunale planprosessar.	2
Ved å reflektere over egen og andres læring kan elever litt etter litt utvikle bevissthet om egne læringsprosesser.	Ved å reflektere over eiga og andre si læring kan elevar litt etter litt utvikle bevisstheit om eigne læringsprosessar.	2
Videre støtter Norge OSSEs høykommissær for nasjonale minoriteter (HCNM) i arbeidet med mellomstatlig dialog om utdanning for minoriteter.	Vidare stør Noreg arbeidet til OSSE-høgkommissæren for nasjonale minoritetar (HCNM) i arbeidet med mellomstatleg dialog om utdanning for minoritetar.	2
Dagens trusler mot regional sikkerhet er i første rekke knyttet til kampen mot internasjonal terrorisme, organisert kriminalitet, interne maktkamper og etniske eller religiøse konflikter.	Trugsmåla i dag mot regional tryggleik stammar i første rekkje frå internasjonal terrorisme, organisert kriminalitet, interne maktkampar og etniske eller religiøse konfliktar.	2
ønsket om å styrke de nasjonale parlamenters rolle i EU-samarbeidet, øke åpenheten i Rådets lovgivende arbeid og styrke borgernes rettigheter.	ønsket om å styrkje den rolla dei nasjonale parlamenta har i EU-samarbeidet, skape meir openheit i det lovgjevande arbeidet i Rådet og styrkje borgarane sine rettar.	2
Videre bør Norge arbeide for en nordisk strategi i FN særlig i forhold til mellominntektslandenes rettigheter og plikter i FN-systemet, samt i forhold til seksuelle og reproduktive rettigheter.	Vidare bør Noreg arbeide for ein nordisk strategi i FN, særleg når det gjeld rettane og pliktane mellominntektslanda har i FN-systemet, i tillegg til seksuelle og reproduktive rettar.	2
De overordnede prioriteringene for regjeringens arbeid i Europarådet er å fremme organisasjonens kjerneverdier demokrati, rettstat og menneskerettigheter.	Dei overordna prioriteringane for arbeidet til regjeringa i Europarådet er å fremje kjerneverdiane til organisasjonen – demokrati, rettsstat og menneskerettar.	2
Brukes til å vurdere barnets vitale tilstand rett etter fødselen, etter fem, og ofte etter ti minutter.	Blir brukt til å vurdere den vitale tilstanden til barnet rett etter fødselen, etter fem, og ofte etter ti minuttar.	2
reflektere særtrekk ved det enkelte helseforetakets opptaksområde og ansvar.	reflektere særtrekk ved det enkelte helseføretaket sitt opptaksområde og ansvar.	2
I januar 2017 ba foretaksmøtet de regionale helseforetakene finne et hensiktsmessig felles format for dokumentasjon og rapportering av spesialisthelsetjenestens arbeid med samfunnsansvar.	I januar 2017 bad føretaksmøtet dei regionale helseføretaka finne eit hensiktsmessig felles format for dokumentasjon og rapportering av spesialisthelsetenesta sitt arbeid med samfunnsansvar.	2
Å; sikre EMD uavhengige og godt kvalifiserte dommere er avgjørende for effektiviteten til Domstolen og kvaliteten på dens avgjørelser.	Å; sikre EMD uavhengige og godt kvalifiserte dommarar er avgjerande for effektiviteten til domstolen og ikkje minst kvaliteten på avgjerdene som vert tekne der.	2
Kommuneplanens arealdel skal bygge på samfunnsdelen og følge opp mål og strategier som er vedtatt der.	Arealdelen i kommuneplanen skal byggje på samfunnsdelen og følgje opp mål og strategiar som er vedtekne der.	2
punkt 1 a) at overenskomsten også får anvendelse på Norges kontinentalsokkel for så vidt gjelder utøvelse av rettigheter med hensyn til havbunnen og undergrunnen samt deres naturherligheter.	punkt 1 a) at avtalen også får verknad på kontinentalsoklane til dei respektive landa når det gjeld utøving av rettar med omsyn til havbotnen og undergrunnen og naturressursar der.	2
punkt 1 a) at overenskomsten også får anvendelse på Norges kontinentalsokkel for så vidt gjelder utøvelse av rettigheter med hensyn til havbunnen og undergrunnen samt deres naturforekomster.	punkt 1 a) at avtalen også får verknad på kontinentalsoklane til dei respektive landa når det gjeld utøving av rettar med omsyn til havbotnen og undergrunnen og naturressursar der.	2
Forsvarer kan etter aktors innledningsforedrag gi noen korte innledende merknader.	Forsvarar kan etter innleiingsføredraget frå aktor gje nokre korte innleiande merknader.	2
Høyesterett kom til at disse omstendighetene i dette tilfellet ikke var tilstrekkelig til å idømme samfunnsstraff, men at fengselsstraffens lengde burde settes til seks måneder.	Høgsterett kom til at desse omstenda i dette tilfellet ikkje var tilstrekkelege til å idømme samfunnsstraff, men at lengden på fengselsstraffa burde settast til seks månader.	2
Det gjelder grønne arealer som er sammenhengende eller tilnærmet sammenhengende og som dekker allmenhetens behov for rekreasjonsarealer i byer og tettsteder.	Det gjeld grøne areal som er samanhengande eller tilnærma samanhengande, og som dekkjer behovet for rekreasjonsareal for allmenta i byar og tettstader.	2
Videre er opplegg for informasjon knyttet til individuelle kliniske studier strukturert og skal om kort tid vises på helsenorge.no med mulighet for lenke fra helseforetakenes egne nettsider.	Vidare er opplegg for informasjon knytt til individuelle kliniske studie er strukturert og skal om kort tid bli vist på helsenorge.no med muligheit for lenke frå helseføretaka sine eigne nettsider.	2
